id,text,rating,author,date,source
70000001040039867_0,"Необычное место с авторской кухней и вниманием к деталям. Меню меняется, и каждый раз блюда удивляют сочетанием вкусов. Атмосфера камерная, персонал вовлечен и может подробно рассказать о каждом блюде. Цена выше средней, но впечатления оправдывают стоимость. Если хочется попробовать что-то действительно нестандартное, это один из лучших вариантов в городе. Отличный опыт, к которому хочется возвращаться.",3,ВладАскеров,2025-12-05,2GIS
70000001040039867_1,"Первый визит в конце октября произвел отличное впечатление. Несмотря на ожидание 30–60 минут из-за большого количества гостей, ввиду отсутствия заблаговременной брони. Атмосфера, внимание к деталям — все на высшем уровне. Кухня и коктейли действительно порадовали, обслуживание было прекрасным, молодой человек, к сожалению не помню имя, рассказал концепцию дал рекомендации по меню. В тот же вечер я забронировал столик на 20 ноября — ко дню рождения девушки.
К сожалению, повторный визит разочаровал. В тесном коридоре скопилось около десяти человек, где хостес сразу предложила снять верхнюю одежду, хотя сделать это там было невозможно. На выбор предложили три малопривлекательных варианта: подоконник, бар в основном зале или бар в «Креветке». Возник закономерный вопрос — зачем бронировать столик за месяц, если нормального места все равно нет?
При попытке пройти посмотреть доступные места в «Креветке» меня во второй раз в пассивно-агрессивной форме попросили раздеться. Это создает ощущение, что от гостей требуют выполнить формальность до того, как предложат достойное размещение. Мы сели за баром и дважды просили пересадить нас при появлении свободных столов. Сотрудники обещали, но за 1,5–2 часа так никто и не подошел, хотя стол действительно освободился.
Отдельный момент — проверка паспорта у девушки и уточнение дня рождения. Мы также дважды подтвердили, но поздравлений не последовало, хотя других гостей поздравляли.
В итоге обслуживание явно не дотягивает до уровня, который задает само же заведение. В следующий раз, увы, выберу другое место — хотя попкорн-креветки и вкусные коктейли буду вспоминать с теплом.",3,ЕгорКириллов,2025-12-05,2GIS
70000001040039867_2,"Все идеально, очень вкусно и атмосферно",3,КириллМ.,2025-12-05,2GIS
70000001040039867_3,"Вкусная еда, авторские коктейли, приятное обслуживание (порекомендуют блюда и коктейли по вашему вкусу) и уютная атмосфера",3,МарияМурзаева,2025-12-05,2GIS
70000001040039867_4,"Неплохо, ел Рамен и ребраС звкзд с неба не хватает, но съедобно)",3,АндрейШавнев,2025-12-05,2GIS
70000001040039867_5,Замечательная кухня и прекрасный персонал,3,ЭлиотСвистоплясов,2025-12-05,2GIS
70000001040039867_6,Очень вкусные коктейли,3,AlexeyMilechin,2025-12-05,2GIS
70000001040039867_7,"Очень вкусная еда. Пробовали почти все закуски из меню и одно основное блюдо.

Ужасные коктейли, из 5 разных штук ни один ни кому не понравился, «переосмысление» коктейлей, которые продает бар — это простое очковтирательство, чтобы продать эти коктейли определенной публике.
Официанты не знают что такое саке и чем их переосмысление негрони отличается от классического.
Десерты — средние.
Тем не менее сумарно общее впечатление на 4 из 5.",3,AleksandrNikolaev,2025-12-05,2GIS
70000001040039867_8,"Место невероятное!
Классное, стильное, интересное.
Мы из Петербурга, и я думала нас уже не удивить гастрономическими впечатлениями. Но…
Интерьер, еда, атмосфера, персонал - просто огромное спасибо!",3,АнастасияБондарь,2025-10-06,2GIS
70000001040039867_9,"очень приятное место и стаф! вкусные блюда, настойки, быстрая подача и тепло на уличных местах ресторана было сидеть, спасибо за вечер! ну и система лояльности хороша",3,ЕкатеринаПетрова,2025-09-29,2GIS
70000001040039867_10,"Польстилась на отзывы, действительно обслуживание хорошее, есть комплимент шампанское на завтрак. Но еда меня совершенно разочаровала. А летающая муха в зале добавила антуража. Яйцо пашот было холодным, переваренным и без жидкого желтка, была какая-то кислинка не особо приятная. Рамен тоже очень разочаровал, холодная лапша(скорее всего вчерашняя) и ненасышенный бульон. Думаю это формат зайти вечером после другого заведения на настойку, но я больше не планирую возвращаться. Ожидание реальность не совпали, все невкусно.",3,Аноним,2025-09-18,2GIS
70000001040039867_11,"Кормилица 🥺
Обожаю такие андеграундные местечки, просто в самое сердечко 🫶🏼",3,MilenaKumaritova,2025-09-15,2GIS
70000001040039867_12,"Место ТОП. Атмосфера, обслуживание, еда.
Но самое удивительное - это концепция, основанная на легендах. Даже меню и барное и те со своим подходом к формированию. Рекомендую всем!",3,ВладиславУ.,2025-12-05,2GIS
70000001040039867_13,Тут вкусно и хорошо! И приветливый компетентый персонал! Хочется возвращаться😍,3,СветланаМишкевич,2025-08-30,2GIS
70000001040039867_14,"Классное место. коктейли необычные - есть сладенькие, есть терпкие, кисленькие. Бар, кухня, официанты - все явно знают, что делают. Претендует на звание любимогл бара",3,СтычНаивняк,2025-08-30,2GIS
70000001040039867_15,Галки это всегда необычное смешение вкусов! Вкусно и неожиданно!,3,СветланаО.,2025-12-05,2GIS
70000001040039867_16,"Очень вкусно, варёнки топ, атмосфера крутая",3,НикитаГлазков,2025-08-20,2GIS
70000001040039867_17,"Были впервые по рекомендации коллеги. Бронировали заранее.
Место очень аутентичное и атмосферное, особенно внутри, при этом по летней веранде до конца прочувствовать весь антураж заведения нельзя.
Еда и напитки мне понравились. Было вкусно.
Персонал приветлив и доброжелателен.",3,Veto_na_leto,2025-08-20,2GIS
70000001040039867_18,"Вкусно, но дороговато. А ещё без брони лучше не приходить, может быть некомфортно.",3,АлексейТ.,2025-12-05,2GIS
70000001040039867_19,"Отличное заведение, все понравилось!",3,ВиталийПетров,2025-08-05,2GIS
70000001040039867_20,"потрясающее место. превосходные кухня, бар, обслуживание. приятная система лояльности.
Галки долгие годы держат марку. молодцы!
мы в стае!",3,СветланаС.,2025-12-05,2GIS
70000001040039867_21,"Были здесь уже раза три,каждый раз в невероятном восторге оставались.Приду сюда ещё раз,обожаю это место!",3,КамильСалахутдинов,2025-07-29,2GIS
70000001040039867_22,"Необычное место) вкусно готовят, любят клиентов! Иногда люблю у них покушать",3,NataliLatani,2025-07-29,2GIS
70000001040039867_23,"Галки, я вас обожаю. Вы лучшие! Невероятная атмосфера, вкуснейшие коктейли. Отличная кухня.",3,ТатьянаМ,2025-04-23,2GIS
70000001040039867_24,"Хорошее место. Шеф повар бомба, необычные блюда и сочетания вкусов вас покорят.
Что оставляет желать лучшего, так это посадка гостей, вроде и бронировали столик на будний день, но всё равно попали за общий стол (что очень расстроило, тк пришли отмечать день рождение). Спасибо конечно, что не зона «сеновал» (если я правильно определила зону), люди просто сидят в коридоре согнувшись в три погибели и мимо них постоянно ходят гости и официанты",3,ВладаС.,2025-12-05,2GIS
70000001040039867_25,"Всем сердцем и душой люблю галки и все их проэкты, каждое посещение-восторг. Но сегодня был первый негативный опыт. Не буду скрываться того, что мы изначально были в плохом настроении, но я надеялась что в любимом месте все прийдет в норму, но к сожалению нам досталась официантка Саша. Она очень надменная и хамоватая, но не со всеми (это я поняла из того, как она общалась со столом напротив). Она проходила мимо и я уточнила свободна ли она сейчас, что бы принять заказ( понимая что может быть загруженность и мы были готовы подождать), на что мы получили высокомерный ответ «ну да, я вот к вам как раз повернулась что бы заказ принять». В дальнейшем мы не получали совершенно никаково внимания от Александры (а нам немного надо). Элементарно даже попросить соль-пришлось вылавливать проходящих официантов. Время было около 12 ночи (потока гостей уже не было) мой коктейль давно закончился и растаял, я хотела повторить. Александра, проигнорировав мою поднятую руку, прошла мимо и начала убирать соседний стол (стоят они очень близко), я попыталась позвать ее «девушка»-игнор. Крикнула громче(еще раз-она, как и столы-были очень рядом), Александра все таки соизволила подойти, но сделала мне замечание о том, что я позвала ее слишком громко фразой «это звучало очень тупо». Честно-галки, их кухня, бар и сопутствующее-любовь. Но Александра точно портит концепт и впечатление. Хотите хорошее впечатление-избегайте эту официантку",3,ЮлияЗакова,2025-07-17,2GIS
70000001040039867_26,"Антуражное место, кухня в целом неплохая, но с нюансами.
Пожалуй, интерьер это единственный большой плюс...

Были в заведении без брони.

Когда пришли, хостес упорно игнорировала, пока что-то без действий рядом дожидалась с гостями. Как минимум в таких случаях здороваются и просят подождать, а не заставляют гостей думать ""нам уйти или что происходит?"". В плюс ей - когда я спросила про концепцию и название, рассказала, это порадовало.

С официанткой видимо просто не повезло - общается очень топорно, так что становится неловко и неуютно. К слову, другой официант был довольно милым.

Усадили к ""подоконнику"", но претензий бы не было, если можно было бы хоть как-то развернуться удобно к еде, но места для ног увы не было совсем. Ещё в добавок на ""столе"" стоит терминал оплаты.

В ресторане безумно тесно. Очень. Составляет сложность вернуться за свой столик.
Освещение ну совсем уж тёмное. Даже для такой концепции. Отсюда невольно возникают и мысли о том, насколько тут вообще реально по нормальному проводить уборку (основного освещения мы так и не приметили на потолке). При нас разбили бокал. Худо-бедно официант убирал осколки, пока кто-то подсвечивал фонариком на телефоне. Крайне сомнительно, что так можно наверняка убрать осколки тем более в такой тесноте и темноте)

Основное блюдо было вкусное, но вишенкой (а точнее клубничкой) на торте стала пиццы с 3 сырами и клубникой. Боялись, что может не понравиться из-за ягоды, но увы! не ягода испортила пиццу. Заявленную горгондзолу мы так ни разу и не почувствовали (и даже не увидели), моцареллу углядеть тоже не смогли (но допустим ввиду своей нейтральности она где-то и была), зато сливочного сыра (который в меню не указан) навалили от души, размазав по всей пицце. В итоге ели мы сливочный пирог с клубникой. Такого мы не ожидали вовсе. Официантка, так и не спросила, понравились ли нам блюда.

В общем, оставило крайней сомнительные впечатления и разочарование от стряпни. Для такого ""уровня"" заведения",3,ЛизаНовикова,2025-07-17,2GIS
70000001040039867_27,"Рекомендую это место всем и каждому! Невероятное место! Внутри все сильно красиво и стильно, везде восковые свечи, официанты отзывчивы и интересны! Брала зеленый салат, а там оказалось три заправки на выбор, очень круто! Брала с имбирной заправкой, сильно хорошее сочетание! Также брала пасту с лисичками, так после этого скребла тарелку ложкой, чтобы собрать остатки соуса! Обожаю) Спасибо, что вы есть! Процветания!",3,ОлесяБянкина,2025-07-17,2GIS
70000001040039867_28,"Самый любимый и вкусный ресторан Москвы. Совершенно без пафоса, но уютный и загадочный",3,НатальяЭ.,2025-12-05,2GIS
70000001040039867_29,"Неплохой бар для свидания. Коктейли делают качественно, выбор большой, можно найти что-то на любой вкус. Интерьер стильный и современный, музыка не слишком громкая, можно поговорить. Цены выше среднего, но оно того стоит. В целом, хорошее место, чтобы провести вечер с девушкой.",3,JohanAmira,2025-07-17,2GIS
70000001040039867_30,"Это спрятанное месте без навигации и опознавательных вывесок и режимников- вначале смутило, но голод и час поиска, катаясь по кругу вокруг домов убеждали посетить заведение.
Смутил шум людности и интерьер, наверное мы просто искали другой тип ресторана - НО !
Когда мы попробовали блюда, точно убедились, что кухня получает самую высокую оценку 👍
Очень вкусно и гастрономически кайфово : осьминог, утка , миньон, копченные сливы в салате покорили ❤️
Особое впечатление преподнес Денис старший бармен, как будто он старый друг который душевно угощает близких друзей, эксклюзивными заграничными напитками и с удовольствием рассказывает о них .
Спасибо за прекрасный вечер !",3,АлександраИванова,2025-07-17,2GIS
70000001040039867_31,"Очень странное место, эффект просто хорошо распиаренного места в подвальном помещении, хотя это место от создателей семпре, но все равно странно!

Официантка была не очень приветлива и позитивна, на вопрос про коктейли несколько раз она заявляла что она не слышит нас вообще, хотя мы сидели рядом с друг другом, горячее принесли быстро. Но салат, салат несли минут 30-40, потом в итоге мы хотели отказаться от салат, но нам сказали что принесут и просят прощение за задержку, спустя не торге время его опять пытались принести в итоге сказали, что салат принесут, но в счет не включат!
И еще, вопрос такой - у вас обычное бумажно меню, формата а4, не абы какой бумаги / почему вы за него так переживаете, это не меню в блокноте, не в виде книжки, долбаный лист а4 с печатью на двух сторонах, и делать замечание что не заляпайте меню итд это просто шутка какая то? Ребят вы серьезно ? С ценами за коктейль в 60 мл за 1000 руб, вы переживаете за бумажное меню ??? С такой плотной посадкой и очередью на входе, бумажное меню дороже этого стоит ?",3,LoraPiano,2025-06-13,2GIS
70000001040039867_32,"Хороший ресторан. Вкусная еда, красивый интерьер. Отличный персонал. Но политика бронирования просто унизительная. Выходной день: бронирую утром на вечер. Я должна внести депозит 8000 минимум за двоих, а на нормальный столик вообще 10000. Кроме того, я должна потратить время на выбор этого столика. А когда я буду деньги на ваш депозит зарабатывать, если буду сидеть пол часа стол выбирать? А если без депозита, то гостей могут посадить на бар (спасибо большое, что уважаете меня как гостя, который звонит заранее. Может еще в туалет посадите?) Другого способа заработать, без этих унижений, менеджер не придумал? Была в этом ресторане, и не раз, но без брони. Больше ходить не буду. Оставлю свои 15-20к в другом месте. Проверьте автоответчик, он должен играть музыку, а он на репите повторяет как мой звонок важен. Если не бронировать то все ок. Ресторан для случайного визита идеальный.",3,ГалинаГорина,2025-06-12,2GIS
70000001040039867_33,"Была в заведении 21мая
У коллег с мясом гарниром был батат, заказала тоже, просто «батат»
Принесли запеченный, то есть вообще не то, попросила сделать фри, ивзинилась если я не так заказала.

В итоге официантка (черные волосы), пришла НА РАЗБОРКИ и буквально орала на меня, повышала голос со словами: Я ЖИ ВАМ СКАЗАЛА што запиченый вы что тут не слушаете😲😲 очень и очень грубо!

Это треш, уважаемое руководство, официантке с черными зачесанными волосами, привет, это роняет имидж заведения до 1 звезды.",3,MariaM,2025-06-07,2GIS
70000001040039867_34,Самое любимое место в Москве. Всегда потрясающая кухня и великолепные коктейли,3,ЕлизаветаС.,2025-12-05,2GIS
70000001040039867_35,"Это просто легендарное место, очень рекомендую 👍",3,РоманЩёкин,2025-06-07,2GIS
