id,text,rating,author,date,source
70000001040039867_341,"Антуражное место, кухня в целом неплохая, но с нюансами.
Пожалуй, интерьер это единственный большой плюс...

Были в заведении без брони.

Когда пришли, хостес упорно игнорировала, пока что-то без действий рядом дожидалась с гостями. Как минимум в таких случаях здороваются и просят подождать, а не заставляют гостей думать ""нам уйти или что происходит?"". В плюс ей - когда я спросила про концепцию и название, рассказала, это порадовало.

С официанткой видимо просто не повезло - общается очень топорно, так что становится неловко и неуютно. К слову, другой официант был довольно милым.

Усадили к ""подоконнику"", но претензий бы не было, если можно было бы хоть как-то развернуться удобно к еде, но места для ног увы не было совсем. Ещё в добавок на ""столе"" стоит терминал оплаты.

В ресторане безумно тесно. Очень. Составляет сложность вернуться за свой столик.
Освещение ну совсем уж тёмное. Даже для такой концепции. Отсюда невольно возникают и мысли о том, насколько тут вообще реально по нормальному проводить уборку (основного освещения мы так и не приметили на потолке). При нас разбили бокал. Худо-бедно официант убирал осколки, пока кто-то подсвечивал фонариком на телефоне. Крайне сомнительно, что так можно наверняка убрать осколки тем более в такой тесноте и темноте)

Основное блюдо было вкусное, но вишенкой (а точнее клубничкой) на торте стала пиццы с 3 сырами и клубникой. Боялись, что может не понравиться из-за ягоды, но увы! не ягода испортила пиццу. Заявленную горгондзолу мы так ни разу и не почувствовали (и даже не увидели), моцареллу углядеть тоже не смогли (но допустим ввиду своей нейтральности она где-то и была), зато сливочного сыра (который в меню не указан) навалили от души, размазав по всей пицце. В итоге ели мы сливочный пирог с клубникой. Такого мы не ожидали вовсе. Официантка, так и не спросила, понравились ли нам блюда.

В общем, оставило крайней сомнительные впечатления и разочарование от стряпни. Для такого ""уровня"" заведения",3,ЛизаНовикова,2025-07-17,2GIS
70000001040039867_342,"Рекомендую это место всем и каждому! Невероятное место! Внутри все сильно красиво и стильно, везде восковые свечи, официанты отзывчивы и интересны! Брала зеленый салат, а там оказалось три заправки на выбор, очень круто! Брала с имбирной заправкой, сильно хорошее сочетание! Также брала пасту с лисичками, так после этого скребла тарелку ложкой, чтобы собрать остатки соуса! Обожаю) Спасибо, что вы есть! Процветания!",3,ОлесяБянкина,2025-07-17,2GIS
70000001040039867_343,"Самый любимый и вкусный ресторан Москвы. Совершенно без пафоса, но уютный и загадочный",3,НатальяЭ.,2025-12-05,2GIS
70000001040039867_344,"Неплохой бар для свидания. Коктейли делают качественно, выбор большой, можно найти что-то на любой вкус. Интерьер стильный и современный, музыка не слишком громкая, можно поговорить. Цены выше среднего, но оно того стоит. В целом, хорошее место, чтобы провести вечер с девушкой.",3,JohanAmira,2025-07-17,2GIS
70000001040039867_345,"Это спрятанное месте без навигации и опознавательных вывесок и режимников- вначале смутило, но голод и час поиска, катаясь по кругу вокруг домов убеждали посетить заведение.
Смутил шум людности и интерьер, наверное мы просто искали другой тип ресторана - НО !
Когда мы попробовали блюда, точно убедились, что кухня получает самую высокую оценку 👍
Очень вкусно и гастрономически кайфово : осьминог, утка , миньон, копченные сливы в салате покорили ❤️
Особое впечатление преподнес Денис старший бармен, как будто он старый друг который душевно угощает близких друзей, эксклюзивными заграничными напитками и с удовольствием рассказывает о них .
Спасибо за прекрасный вечер !",3,АлександраИванова,2025-07-17,2GIS
70000001040039867_346,"Очень странное место, эффект просто хорошо распиаренного места в подвальном помещении, хотя это место от создателей семпре, но все равно странно!

Официантка была не очень приветлива и позитивна, на вопрос про коктейли несколько раз она заявляла что она не слышит нас вообще, хотя мы сидели рядом с друг другом, горячее принесли быстро. Но салат, салат несли минут 30-40, потом в итоге мы хотели отказаться от салат, но нам сказали что принесут и просят прощение за задержку, спустя не торге время его опять пытались принести в итоге сказали, что салат принесут, но в счет не включат!
И еще, вопрос такой - у вас обычное бумажно меню, формата а4, не абы какой бумаги / почему вы за него так переживаете, это не меню в блокноте, не в виде книжки, долбаный лист а4 с печатью на двух сторонах, и делать замечание что не заляпайте меню итд это просто шутка какая то? Ребят вы серьезно ? С ценами за коктейль в 60 мл за 1000 руб, вы переживаете за бумажное меню ??? С такой плотной посадкой и очередью на входе, бумажное меню дороже этого стоит ?",3,LoraPiano,2025-06-13,2GIS
70000001040039867_347,"Хороший ресторан. Вкусная еда, красивый интерьер. Отличный персонал. Но политика бронирования просто унизительная. Выходной день: бронирую утром на вечер. Я должна внести депозит 8000 минимум за двоих, а на нормальный столик вообще 10000. Кроме того, я должна потратить время на выбор этого столика. А когда я буду деньги на ваш депозит зарабатывать, если буду сидеть пол часа стол выбирать? А если без депозита, то гостей могут посадить на бар (спасибо большое, что уважаете меня как гостя, который звонит заранее. Может еще в туалет посадите?) Другого способа заработать, без этих унижений, менеджер не придумал? Была в этом ресторане, и не раз, но без брони. Больше ходить не буду. Оставлю свои 15-20к в другом месте. Проверьте автоответчик, он должен играть музыку, а он на репите повторяет как мой звонок важен. Если не бронировать то все ок. Ресторан для случайного визита идеальный.",3,ГалинаГорина,2025-06-12,2GIS
70000001040039867_348,"Была в заведении 21мая
У коллег с мясом гарниром был батат, заказала тоже, просто «батат»
Принесли запеченный, то есть вообще не то, попросила сделать фри, ивзинилась если я не так заказала.

В итоге официантка (черные волосы), пришла НА РАЗБОРКИ и буквально орала на меня, повышала голос со словами: Я ЖИ ВАМ СКАЗАЛА што запиченый вы что тут не слушаете😲😲 очень и очень грубо!

Это треш, уважаемое руководство, официантке с черными зачесанными волосами, привет, это роняет имидж заведения до 1 звезды.",3,MariaM,2025-06-07,2GIS
70000001040039867_349,Самое любимое место в Москве. Всегда потрясающая кухня и великолепные коктейли,3,ЕлизаветаС.,2025-12-05,2GIS
70000001040039867_350,"Это просто легендарное место, очень рекомендую 👍",3,РоманЩёкин,2025-06-07,2GIS
70000001040039867_351,"С коллегами любим устраивать ивенты, и недавно открыли для себя андеграунд ресторан Галки. Помимо самой концепции оценили меню, в котором есть не только мясо, рыба, но и неординарные закуски. Попкорн/креветки васаби и татаки из говядины/костный мозг понравилась всем, также как и вкусные фруктовые коктейли. Круто, что Ultima Guide помог открыть нам такое интересное место.",3,ВероникаКалинина,2025-06-07,2GIS
70000001040039867_352,"Камамбер был резиновый, хлеб к нему деревянный, пицца сухая! Одно из самых невкусных мест города. И в заведении нет трубочек к напитку (девочки, губы не красим, помада останется на стакане)",3,ЭлеонораС,2025-06-07,2GIS
70000001040039867_353,"Вкусный тар-тар из говядины, в пицце с трюфелем не хватило трюфеля - и в целом вкусовых ощущений",3,ЕкатеринаП.,2025-12-05,2GIS
70000001040039867_354,"С мужем была годовщина, хотела удивить чем-то необычным, пригласила в Галки😁 интерьер кулуарный с множеством деталей, обстановка таинственная✨ еда просто топ🔥, я ела и не понимала как может быть так вкусно, салат просто буря вкусовых сочетаний❤️ пицца и рёбра тоже на высоте, коктейли вкусные, я брала классику с маракуей и игристым и его сделали волшебным👌🏻 официанты и персонал учитивы и приветливы, в общем однозначно 5 баллов, я ещё вернусь😋",3,НаталаБорисова,2025-05-01,2GIS
70000001040039867_355,"Вкусная кухня, коктейли и настойки. Отличный концептуальный ресторан.",3,КонстантинК.,2025-12-05,2GIS
70000001040039867_356,"Для ресторана тут очень шумно, даже днем. Это скорее бар, с хорошей для бара кухней. Напитки были вкусные, пицца неплохая, но не вау. Сотрудники все очень милые.",3,РитаК,2025-05-08,2GIS
70000001040039867_357,"Мало места, плотная посадка, шумно, место не для всех",3,ЕкатеринаС.,2025-12-05,2GIS
70000001040039867_358,"Неприветливый персонал. Девушка хостес высокая с темными волосами даже не поздоровалась и сразу ушла с кем-то другим из гостей. Я стояла ещё минуту на входе, пока не подошла другая девушка. Пока мы с ней разбирались с бронью, первая хостес вернулась, встала прямо между нами и начала копошиться в планшете. Мне пришлось её обойти, чтобы продолжить разговор. В зале были свободные столики, но нас с подругой посадили за подоконник. Впечатление сразу было испорчено. Мы еле еле дозвались официанта, чтобы рассчитаться и довольно быстро ушли. Возвращаться не планирую.",3,АленаШ,2025-04-23,2GIS
70000001040039867_359,"Вкусная еда,все вкусно)",3,АннаП.,2025-12-05,2GIS
70000001040039867_360,"Необычное место с авторской кухней и вниманием к деталям. Меню меняется, и каждый раз блюда удивляют сочетанием вкусов. Атмосфера камерная, персонал вовлечен и может подробно рассказать о каждом блюде. Цена выше средней, но впечатления оправдывают стоимость. Если хочется попробовать что-то действительно нестандартное, это один из лучших вариантов в городе. Отличный опыт, к которому хочется возвращаться.",3,ВладАскеров,2025-12-05,2GIS
70000001040039867_361,"Первый визит в конце октября произвел отличное впечатление. Несмотря на ожидание 30–60 минут из-за большого количества гостей, ввиду отсутствия заблаговременной брони. Атмосфера, внимание к деталям — все на высшем уровне. Кухня и коктейли действительно порадовали, обслуживание было прекрасным, молодой человек, к сожалению не помню имя, рассказал концепцию дал рекомендации по меню. В тот же вечер я забронировал столик на 20 ноября — ко дню рождения девушки.
К сожалению, повторный визит разочаровал. В тесном коридоре скопилось около десяти человек, где хостес сразу предложила снять верхнюю одежду, хотя сделать это там было невозможно. На выбор предложили три малопривлекательных варианта: подоконник, бар в основном зале или бар в «Креветке». Возник закономерный вопрос — зачем бронировать столик за месяц, если нормального места все равно нет?
При попытке пройти посмотреть доступные места в «Креветке» меня во второй раз в пассивно-агрессивной форме попросили раздеться. Это создает ощущение, что от гостей требуют выполнить формальность до того, как предложат достойное размещение. Мы сели за баром и дважды просили пересадить нас при появлении свободных столов. Сотрудники обещали, но за 1,5–2 часа так никто и не подошел, хотя стол действительно освободился.
Отдельный момент — проверка паспорта у девушки и уточнение дня рождения. Мы также дважды подтвердили, но поздравлений не последовало, хотя других гостей поздравляли.
В итоге обслуживание явно не дотягивает до уровня, который задает само же заведение. В следующий раз, увы, выберу другое место — хотя попкорн-креветки и вкусные коктейли буду вспоминать с теплом.",3,ЕгорКириллов,2025-12-05,2GIS
70000001040039867_362,"Все идеально, очень вкусно и атмосферно",3,КириллМ.,2025-12-05,2GIS
70000001040039867_363,"Вкусная еда, авторские коктейли, приятное обслуживание (порекомендуют блюда и коктейли по вашему вкусу) и уютная атмосфера",3,МарияМурзаева,2025-12-05,2GIS
70000001040039867_364,"Неплохо, ел Рамен и ребраС звкзд с неба не хватает, но съедобно)",3,АндрейШавнев,2025-12-05,2GIS
70000001040039867_365,Замечательная кухня и прекрасный персонал,3,ЭлиотСвистоплясов,2025-12-05,2GIS
70000001040039867_366,Очень вкусные коктейли,3,AlexeyMilechin,2025-12-05,2GIS
70000001040039867_367,"Очень вкусная еда. Пробовали почти все закуски из меню и одно основное блюдо.

Ужасные коктейли, из 5 разных штук ни один ни кому не понравился, «переосмысление» коктейлей, которые продает бар — это простое очковтирательство, чтобы продать эти коктейли определенной публике.
Официанты не знают что такое саке и чем их переосмысление негрони отличается от классического.
Десерты — средние.
Тем не менее сумарно общее впечатление на 4 из 5.",3,AleksandrNikolaev,2025-12-05,2GIS
70000001040039867_368,"Место невероятное!
Классное, стильное, интересное.
Мы из Петербурга, и я думала нас уже не удивить гастрономическими впечатлениями. Но…
Интерьер, еда, атмосфера, персонал - просто огромное спасибо!",3,АнастасияБондарь,2025-10-06,2GIS
70000001040039867_369,"очень приятное место и стаф! вкусные блюда, настойки, быстрая подача и тепло на уличных местах ресторана было сидеть, спасибо за вечер! ну и система лояльности хороша",3,ЕкатеринаПетрова,2025-09-29,2GIS
70000001040039867_370,"Польстилась на отзывы, действительно обслуживание хорошее, есть комплимент шампанское на завтрак. Но еда меня совершенно разочаровала. А летающая муха в зале добавила антуража. Яйцо пашот было холодным, переваренным и без жидкого желтка, была какая-то кислинка не особо приятная. Рамен тоже очень разочаровал, холодная лапша(скорее всего вчерашняя) и ненасышенный бульон. Думаю это формат зайти вечером после другого заведения на настойку, но я больше не планирую возвращаться. Ожидание реальность не совпали, все невкусно.",3,Аноним,2025-09-18,2GIS
70000001040039867_371,"Кормилица 🥺
Обожаю такие андеграундные местечки, просто в самое сердечко 🫶🏼",3,MilenaKumaritova,2025-09-15,2GIS
70000001040039867_372,"Место ТОП. Атмосфера, обслуживание, еда.
Но самое удивительное - это концепция, основанная на легендах. Даже меню и барное и те со своим подходом к формированию. Рекомендую всем!",3,ВладиславУ.,2025-12-05,2GIS
70000001040039867_373,Тут вкусно и хорошо! И приветливый компетентый персонал! Хочется возвращаться😍,3,СветланаМишкевич,2025-08-30,2GIS
70000001040039867_374,"Классное место. коктейли необычные - есть сладенькие, есть терпкие, кисленькие. Бар, кухня, официанты - все явно знают, что делают. Претендует на звание любимогл бара",3,СтычНаивняк,2025-08-30,2GIS
70000001040039867_375,Галки это всегда необычное смешение вкусов! Вкусно и неожиданно!,3,СветланаО.,2025-12-05,2GIS
70000001040039867_376,"Очень вкусно, варёнки топ, атмосфера крутая",3,НикитаГлазков,2025-08-20,2GIS
70000001040039867_377,"Были впервые по рекомендации коллеги. Бронировали заранее.
Место очень аутентичное и атмосферное, особенно внутри, при этом по летней веранде до конца прочувствовать весь антураж заведения нельзя.
Еда и напитки мне понравились. Было вкусно.
Персонал приветлив и доброжелателен.",3,Veto_na_leto,2025-08-20,2GIS
70000001040039867_378,"Вкусно, но дороговато. А ещё без брони лучше не приходить, может быть некомфортно.",3,АлексейТ.,2025-12-05,2GIS
70000001040039867_379,"Отличное заведение, все понравилось!",3,ВиталийПетров,2025-08-05,2GIS
70000001040039867_380,"потрясающее место. превосходные кухня, бар, обслуживание. приятная система лояльности.
Галки долгие годы держат марку. молодцы!
мы в стае!",3,СветланаС.,2025-12-05,2GIS
